{
    "id": "tag-artesanias-016",
    "name": "Artesanías",
    "slug": "artesanias",
    "description": "Productos y talleres artesanales locales",
    "type": "activity",
    "category": "secondary",
    "color": "#DEB887",
    "icon": "craft",
    "isActive": true,
    "usageCount": 0,
    "adminInfo": {
        "notes": "Tag para artesanías y productos locales",
        "favorite": false
    }
}
